No.     Time           Source                Destination           Protocol Length Info
      1 0.000000000    192.168.255.9         224.0.0.251           MDNS     87     Standard query 0x0000  PTR _ipps._tcp.local, "QM" question PTR _ipp._tcp.local, "QM" question

Frame 1: 87 bytes on wire (696 bits), 87 bytes captured (696 bits) on interface 0
Ethernet II, Src: 00:9a:9e:9d:93:47 (00:9a:9e:9d:93:47), Dst: IPv4mcast_fb (01:00:5e:00:00:fb)
Internet Protocol Version 4, Src: 192.168.255.9 (192.168.255.9), Dst: 224.0.0.251 (224.0.0.251)
User Datagram Protocol, Src Port: 5353 (5353), Dst Port: 5353 (5353)
Domain Name System (query)

No.     Time           Source                Destination           Protocol Length Info
      2 1.638338000    fe80::29a:9eff:fe9d:9347 ff02::fb              MDNS     107    Standard query 0x0000  PTR _ipps._tcp.local, "QM" question PTR _ipp._tcp.local, "QM" question

Frame 2: 107 bytes on wire (856 bits), 107 bytes captured (856 bits) on interface 0
Ethernet II, Src: 00:9a:9e:9d:93:47 (00:9a:9e:9d:93:47), Dst: IPv6mcast_fb (33:33:00:00:00:fb)
Internet Protocol Version 6, Src: fe80::29a:9eff:fe9d:9347 (fe80::29a:9eff:fe9d:9347), Dst: ff02::fb (ff02::fb)
User Datagram Protocol, Src Port: 5353 (5353), Dst Port: 5353 (5353)
Domain Name System (query)

No.     Time           Source                Destination           Protocol Length Info
      3 4.429104000    00:9a:9e:9d:93:47     Broadcast             ARP      42     Who has 192.168.255.10?  Tell 192.168.255.9

Frame 3: 42 bytes on wire (336 bits), 42 bytes captured (336 bits) on interface 0
Ethernet II, Src: 00:9a:9e:9d:93:47 (00:9a:9e:9d:93:47), Dst: Broadcast (ff:ff:ff:ff:ff:ff)
Address Resolution Protocol (request)

No.     Time           Source                Destination           Protocol Length Info
      4 4.429768000    Ricoh_e5:a9:f8        00:9a:9e:9d:93:47     ARP      60     192.168.255.10 is at 00:00:74:e5:a9:f8

Frame 4: 60 bytes on wire (480 bits), 60 bytes captured (480 bits) on interface 0
Ethernet II, Src: Ricoh_e5:a9:f8 (00:00:74:e5:a9:f8), Dst: 00:9a:9e:9d:93:47 (00:9a:9e:9d:93:47)
Address Resolution Protocol (reply)

No.     Time           Source                Destination           Protocol Length Info
      5 4.429780000    192.168.255.9         192.168.255.10        TCP      74     50906→50240 [SYN] Seq=0 Win=29200 Len=0 MSS=1460 SACK_PERM=1 TSval=1837118 TSecr=0 WS=128

Frame 5: 74 bytes on wire (592 bits), 74 bytes captured (592 bits) on interface 0
Ethernet II, Src: 00:9a:9e:9d:93:47 (00:9a:9e:9d:93:47), Dst: Ricoh_e5:a9:f8 (00:00:74:e5:a9:f8)
Internet Protocol Version 4, Src: 192.168.255.9 (192.168.255.9), Dst: 192.168.255.10 (192.168.255.10)
Transmission Control Protocol, Src Port: 50906 (50906), Dst Port: 50240 (50240), Seq: 0, Len: 0

No.     Time           Source                Destination           Protocol Length Info
      6 4.430018000    192.168.255.10        192.168.255.9         TCP      74     50240→50906 [SYN, ACK] Seq=0 Ack=1 Win=8192 Len=0 MSS=1460 WS=1 TSval=5720 TSecr=1837118

Frame 6: 74 bytes on wire (592 bits), 74 bytes captured (592 bits) on interface 0
Ethernet II, Src: Ricoh_e5:a9:f8 (00:00:74:e5:a9:f8), Dst: 00:9a:9e:9d:93:47 (00:9a:9e:9d:93:47)
Internet Protocol Version 4, Src: 192.168.255.10 (192.168.255.10), Dst: 192.168.255.9 (192.168.255.9)
Transmission Control Protocol, Src Port: 50240 (50240), Dst Port: 50906 (50906), Seq: 0, Ack: 1, Len: 0

No.     Time           Source                Destination           Protocol Length Info
      7 4.430040000    192.168.255.9         192.168.255.10        TCP      66     50906→50240 [ACK] Seq=1 Ack=1 Win=29312 Len=0 TSval=1837118 TSecr=5720

Frame 7: 66 bytes on wire (528 bits), 66 bytes captured (528 bits) on interface 0
Ethernet II, Src: 00:9a:9e:9d:93:47 (00:9a:9e:9d:93:47), Dst: Ricoh_e5:a9:f8 (00:00:74:e5:a9:f8)
Internet Protocol Version 4, Src: 192.168.255.9 (192.168.255.9), Dst: 192.168.255.10 (192.168.255.10)
Transmission Control Protocol, Src Port: 50906 (50906), Dst Port: 50240 (50240), Seq: 1, Ack: 1, Len: 0

No.     Time           Source                Destination           Protocol Length Info
      8 4.463557000    192.168.255.9         192.168.255.10        TCP      74     52356→50241 [SYN] Seq=0 Win=29200 Len=0 MSS=1460 SACK_PERM=1 TSval=1837127 TSecr=0 WS=128

Frame 8: 74 bytes on wire (592 bits), 74 bytes captured (592 bits) on interface 0
Ethernet II, Src: 00:9a:9e:9d:93:47 (00:9a:9e:9d:93:47), Dst: Ricoh_e5:a9:f8 (00:00:74:e5:a9:f8)
Internet Protocol Version 4, Src: 192.168.255.9 (192.168.255.9), Dst: 192.168.255.10 (192.168.255.10)
Transmission Control Protocol, Src Port: 52356 (52356), Dst Port: 50241 (50241), Seq: 0, Len: 0

No.     Time           Source                Destination           Protocol Length Info
      9 4.463786000    192.168.255.10        192.168.255.9         TCP      74     50241→52356 [SYN, ACK] Seq=0 Ack=1 Win=8192 Len=0 MSS=1460 WS=1 TSval=5720 TSecr=1837127

Frame 9: 74 bytes on wire (592 bits), 74 bytes captured (592 bits) on interface 0
Ethernet II, Src: Ricoh_e5:a9:f8 (00:00:74:e5:a9:f8), Dst: 00:9a:9e:9d:93:47 (00:9a:9e:9d:93:47)
Internet Protocol Version 4, Src: 192.168.255.10 (192.168.255.10), Dst: 192.168.255.9 (192.168.255.9)
Transmission Control Protocol, Src Port: 50241 (50241), Dst Port: 52356 (52356), Seq: 0, Ack: 1, Len: 0

No.     Time           Source                Destination           Protocol Length Info
     10 4.463809000    192.168.255.9         192.168.255.10        TCP      66     52356→50241 [ACK] Seq=1 Ack=1 Win=29312 Len=0 TSval=1837127 TSecr=5720

Frame 10: 66 bytes on wire (528 bits), 66 bytes captured (528 bits) on interface 0
Ethernet II, Src: 00:9a:9e:9d:93:47 (00:9a:9e:9d:93:47), Dst: Ricoh_e5:a9:f8 (00:00:74:e5:a9:f8)
Internet Protocol Version 4, Src: 192.168.255.9 (192.168.255.9), Dst: 192.168.255.10 (192.168.255.10)
Transmission Control Protocol, Src Port: 52356 (52356), Dst Port: 50241 (50241), Seq: 1, Ack: 1, Len: 0

No.     Time           Source                Destination           Protocol Length Info
     11 4.614129000    192.168.255.10        192.168.255.9         TCP      214    50241→52356 [PSH, ACK] Seq=1 Ack=1 Win=8192 Len=148 TSval=5720 TSecr=1837127

Frame 11: 214 bytes on wire (1712 bits), 214 bytes captured (1712 bits) on interface 0
Ethernet II, Src: Ricoh_e5:a9:f8 (00:00:74:e5:a9:f8), Dst: 00:9a:9e:9d:93:47 (00:9a:9e:9d:93:47)
Internet Protocol Version 4, Src: 192.168.255.10 (192.168.255.10), Dst: 192.168.255.9 (192.168.255.9)
Transmission Control Protocol, Src Port: 50241 (50241), Dst Port: 52356 (52356), Seq: 1, Ack: 1, Len: 148
Data (148 bytes)

0000  90 00 00 00 0f 00 00 00 01 00 00 00 00 00 00 00   ................
0010  00 00 00 00 06 00 00 00 00 00 00 00 86 56 4d be   .............VM.
0020  a5 73 5d 3f 69 aa c7 3d cb 1d b6 be 0b e6 80 be   .s]?i..=........
0030  c9 95 e5 bd e6 65 98 be 00 00 00 00 00 00 00 00   .....e..........
0040  00 00 00 00 00 00 00 00 00 00 00 00 00 00 00 00   ................
0050  00 00 00 00 00 00 00 00 00 00 00 00 00 00 00 00   ................
0060  00 00 00 00 00 00 00 00 00 00 00 00 00 00 00 00   ................
0070  00 00 00 00 00 00 00 00 00 00 00 00 00 00 00 00   ................
0080  00 00 00 00 00 00 00 00 00 00 00 00 00 00 00 00   ................
0090  00 00 00 00                                       ....

No.     Time           Source                Destination           Protocol Length Info
     12 4.614166000    192.168.255.9         192.168.255.10        TCP      66     52356→50241 [ACK] Seq=1 Ack=149 Win=30336 Len=0 TSval=1837164 TSecr=5720

Frame 12: 66 bytes on wire (528 bits), 66 bytes captured (528 bits) on interface 0
Ethernet II, Src: 00:9a:9e:9d:93:47 (00:9a:9e:9d:93:47), Dst: Ricoh_e5:a9:f8 (00:00:74:e5:a9:f8)
Internet Protocol Version 4, Src: 192.168.255.9 (192.168.255.9), Dst: 192.168.255.10 (192.168.255.10)
Transmission Control Protocol, Src Port: 52356 (52356), Dst Port: 50241 (50241), Seq: 1, Ack: 149, Len: 0

No.     Time           Source                Destination           Protocol Length Info
     13 4.615876000    192.168.255.10        192.168.255.9         TCP      214    50241→52356 [PSH, ACK] Seq=149 Ack=1 Win=8192 Len=148 TSval=5720 TSecr=1837164

Frame 13: 214 bytes on wire (1712 bits), 214 bytes captured (1712 bits) on interface 0
Ethernet II, Src: Ricoh_e5:a9:f8 (00:00:74:e5:a9:f8), Dst: 00:9a:9e:9d:93:47 (00:9a:9e:9d:93:47)
Internet Protocol Version 4, Src: 192.168.255.10 (192.168.255.10), Dst: 192.168.255.9 (192.168.255.9)
Transmission Control Protocol, Src Port: 50241 (50241), Dst Port: 52356 (52356), Seq: 149, Ack: 1, Len: 148
Data (148 bytes)

0000  90 00 00 00 0f 00 00 00 01 00 00 00 00 00 00 00   ................
0010  01 00 00 00 06 00 00 00 00 00 00 00 a0 92 92 be   ................
0020  27 50 bb 3f 73 1d 0c bd 07 17 62 bf 79 25 a9 bf   'P.?s.....b.y%..
0030  a8 63 da bf 49 e7 1b 40 00 00 00 00 00 00 00 00   .c..I..@........
0040  00 00 00 00 00 00 00 00 00 00 00 00 00 00 00 00   ................
0050  00 00 00 00 00 00 00 00 00 00 00 00 00 00 00 00   ................
0060  00 00 00 00 00 00 00 00 00 00 00 00 00 00 00 00   ................
0070  00 00 00 00 00 00 00 00 00 00 00 00 00 00 00 00   ................
0080  00 00 00 00 00 00 00 00 00 00 00 00 00 00 00 00   ................
0090  00 00 00 00                                       ....

No.     Time           Source                Destination           Protocol Length Info
     14 4.615902000    192.168.255.9         192.168.255.10        TCP      66     52356→50241 [ACK] Seq=1 Ack=297 Win=31360 Len=0 TSval=1837165 TSecr=5720

Frame 14: 66 bytes on wire (528 bits), 66 bytes captured (528 bits) on interface 0
Ethernet II, Src: 00:9a:9e:9d:93:47 (00:9a:9e:9d:93:47), Dst: Ricoh_e5:a9:f8 (00:00:74:e5:a9:f8)
Internet Protocol Version 4, Src: 192.168.255.9 (192.168.255.9), Dst: 192.168.255.10 (192.168.255.10)
Transmission Control Protocol, Src Port: 52356 (52356), Dst Port: 50241 (50241), Seq: 1, Ack: 297, Len: 0

No.     Time           Source                Destination           Protocol Length Info
     15 4.615877000    192.168.255.10        192.168.255.9         TCP      214    50241→52356 [PSH, ACK] Seq=297 Ack=1 Win=8192 Len=148 TSval=5720 TSecr=1837164

Frame 15: 214 bytes on wire (1712 bits), 214 bytes captured (1712 bits) on interface 0
Ethernet II, Src: Ricoh_e5:a9:f8 (00:00:74:e5:a9:f8), Dst: 00:9a:9e:9d:93:47 (00:9a:9e:9d:93:47)
Internet Protocol Version 4, Src: 192.168.255.10 (192.168.255.10), Dst: 192.168.255.9 (192.168.255.9)
Transmission Control Protocol, Src Port: 50241 (50241), Dst Port: 52356 (52356), Seq: 297, Ack: 1, Len: 148
Data (148 bytes)

0000  90 00 00 00 0f 00 00 00 01 00 00 00 00 00 00 00   ................
0010  02 00 00 00 06 00 00 00 00 00 00 00 72 39 7c bd   ............r9|.
0020  00 00 00 00 00 00 00 00 00 00 00 00 00 00 00 00   ................
0030  00 00 00 00 00 00 00 00 00 00 00 00 00 00 00 00   ................
0040  00 00 00 00 00 00 00 00 00 00 00 00 00 00 00 00   ................
0050  00 00 00 00 fe c3 a3 4b a0 ab ba 48 10 47 c3 4b   .......K...H.G.K
0060  59 2a ca 4b 00 00 00 00 00 00 00 00 00 00 00 00   Y*.K............
0070  00 00 00 00 00 00 00 00 00 00 00 00 00 00 00 00   ................
0080  00 00 00 00 00 00 00 00 00 00 00 00 00 00 00 00   ................
0090  00 00 00 00                                       ....

No.     Time           Source                Destination           Protocol Length Info
     16 4.615925000    192.168.255.9         192.168.255.10        TCP      66     52356→50241 [ACK] Seq=1 Ack=445 Win=32512 Len=0 TSval=1837165 TSecr=5720

Frame 16: 66 bytes on wire (528 bits), 66 bytes captured (528 bits) on interface 0
Ethernet II, Src: 00:9a:9e:9d:93:47 (00:9a:9e:9d:93:47), Dst: Ricoh_e5:a9:f8 (00:00:74:e5:a9:f8)
Internet Protocol Version 4, Src: 192.168.255.9 (192.168.255.9), Dst: 192.168.255.10 (192.168.255.10)
Transmission Control Protocol, Src Port: 52356 (52356), Dst Port: 50241 (50241), Seq: 1, Ack: 445, Len: 0

No.     Time           Source                Destination           Protocol Length Info
     17 4.615992000    192.168.255.10        192.168.255.9         TCP      614    50241→52356 [PSH, ACK] Seq=445 Ack=1 Win=8192 Len=548 TSval=5720 TSecr=1837164

Frame 17: 614 bytes on wire (4912 bits), 614 bytes captured (4912 bits) on interface 0
Ethernet II, Src: Ricoh_e5:a9:f8 (00:00:74:e5:a9:f8), Dst: 00:9a:9e:9d:93:47 (00:9a:9e:9d:93:47)
Internet Protocol Version 4, Src: 192.168.255.10 (192.168.255.10), Dst: 192.168.255.9 (192.168.255.9)
Transmission Control Protocol, Src Port: 50241 (50241), Dst Port: 52356 (52356), Seq: 445, Ack: 1, Len: 548
Data (548 bytes)

0000  20 02 00 00 e1 07 00 00 01 00 00 00 00 00 00 00    ...............
0010  03 00 00 00 00 00 00 00 06 00 00 00 00 00 00 00   ................
0020  86 56 4d be a5 73 5d 3f 69 aa c7 3d cb 1d b6 be   .VM..s]?i..=....
0030  0b e6 80 be c9 95 e5 bd e6 65 98 be 00 00 00 00   .........e......
0040  00 00 00 00 00 00 00 00 00 00 00 00 00 00 00 00   ................
0050  00 00 00 00 00 00 00 00 00 00 00 00 00 00 00 00   ................
0060  00 00 00 00 00 00 00 00 00 00 00 00 00 00 00 00   ................
0070  00 00 00 00 00 00 00 00 00 00 00 00 00 00 00 00   ................
0080  00 00 00 00 00 00 00 00 00 00 00 00 00 00 00 00   ................
0090  00 00 00 00 00 00 00 00 01 00 00 00 06 00 00 00   ................
00a0  00 00 00 00 a0 92 92 be 27 50 bb 3f 73 1d 0c bd   ........'P.?s...
00b0  07 17 62 bf 79 25 a9 bf a8 63 da bf 49 e7 1b 40   ..b.y%...c..I..@
00c0  00 00 00 00 00 00 00 00 00 00 00 00 00 00 00 00   ................
00d0  00 00 00 00 00 00 00 00 00 00 00 00 00 00 00 00   ................
00e0  00 00 00 00 00 00 00 00 00 00 00 00 00 00 00 00   ................
00f0  00 00 00 00 00 00 00 00 00 00 00 00 00 00 00 00   ................
0100  00 00 00 00 00 00 00 00 00 00 00 00 00 00 00 00   ................
0110  00 00 00 00 00 00 00 00 00 00 00 00 02 00 00 00   ................
0120  06 00 00 00 00 00 00 00 72 39 7c bd 00 00 00 00   ........r9|.....
0130  00 00 00 00 00 00 00 00 00 00 00 00 00 00 00 00   ................
0140  00 00 00 00 00 00 00 00 00 00 00 00 00 00 00 00   ................
0150  00 00 00 00 00 00 00 00 00 00 00 00 00 00 00 00   ................
0160  fe c3 a3 4b a0 ab ba 48 10 47 c3 4b 59 2a ca 4b   ...K...H.G.KY*.K
0170  00 00 00 00 00 00 00 00 00 00 00 00 00 00 00 00   ................
0180  00 00 00 00 00 00 00 00 00 00 00 00 00 00 00 00   ................
0190  00 00 00 00 00 00 00 00 00 00 00 00 00 00 00 00   ................
01a0  00 00 00 00 00 00 00 00 00 00 00 00 00 00 00 00   ................
01b0  00 00 00 00 00 00 00 00 00 00 00 00 00 00 00 00   ................
01c0  00 00 00 00 00 00 00 00 00 00 00 00 00 00 00 00   ................
01d0  00 00 00 00 00 00 00 00 00 00 00 00 00 00 00 00   ................
01e0  00 00 00 00 00 00 00 00 00 00 00 00 00 00 00 00   ................
01f0  00 00 00 00 00 00 00 00 00 00 00 00 00 00 00 00   ................
0200  00 00 00 00 00 00 00 00 00 00 00 00 00 00 00 00   ................
0210  00 00 00 00 00 00 00 00 00 00 00 00 00 00 00 00   ................
0220  00 00 00 00                                       ....

No.     Time           Source                Destination           Protocol Length Info
     18 4.616007000    192.168.255.9         192.168.255.10        TCP      66     52356→50241 [ACK] Seq=1 Ack=993 Win=33536 Len=0 TSval=1837165 TSecr=5720

Frame 18: 66 bytes on wire (528 bits), 66 bytes captured (528 bits) on interface 0
Ethernet II, Src: 00:9a:9e:9d:93:47 (00:9a:9e:9d:93:47), Dst: Ricoh_e5:a9:f8 (00:00:74:e5:a9:f8)
Internet Protocol Version 4, Src: 192.168.255.9 (192.168.255.9), Dst: 192.168.255.10 (192.168.255.10)
Transmission Control Protocol, Src Port: 52356 (52356), Dst Port: 50241 (50241), Seq: 1, Ack: 993, Len: 0

No.     Time           Source                Destination           Protocol Length Info
     19 4.615993000    192.168.255.10        192.168.255.9         TCP      110    50241→52356 [PSH, ACK] Seq=993 Ack=1 Win=8192 Len=44 TSval=5720 TSecr=1837164

Frame 19: 110 bytes on wire (880 bits), 110 bytes captured (880 bits) on interface 0
Ethernet II, Src: Ricoh_e5:a9:f8 (00:00:74:e5:a9:f8), Dst: 00:9a:9e:9d:93:47 (00:9a:9e:9d:93:47)
Internet Protocol Version 4, Src: 192.168.255.10 (192.168.255.10), Dst: 192.168.255.9 (192.168.255.9)
Transmission Control Protocol, Src Port: 50241 (50241), Dst Port: 52356 (52356), Seq: 993, Ack: 1, Len: 44
Data (44 bytes)

0000  28 00 00 00 0d 00 00 00 01 00 00 00 00 00 00 00   (...............
0010  00 00 00 00 00 00 00 00 00 00 00 00 00 00 00 00   ................
0020  00 00 00 00 02 00 00 00 00 00 00 00               ............

No.     Time           Source                Destination           Protocol Length Info
     20 4.616019000    192.168.255.9         192.168.255.10        TCP      66     52356→50241 [ACK] Seq=1 Ack=1037 Win=33536 Len=0 TSval=1837165 TSecr=5720

Frame 20: 66 bytes on wire (528 bits), 66 bytes captured (528 bits) on interface 0
Ethernet II, Src: 00:9a:9e:9d:93:47 (00:9a:9e:9d:93:47), Dst: Ricoh_e5:a9:f8 (00:00:74:e5:a9:f8)
Internet Protocol Version 4, Src: 192.168.255.9 (192.168.255.9), Dst: 192.168.255.10 (192.168.255.10)
Transmission Control Protocol, Src Port: 52356 (52356), Dst Port: 50241 (50241), Seq: 1, Ack: 1037, Len: 0

No.     Time           Source                Destination           Protocol Length Info
     21 4.640791000    192.168.255.10        192.168.255.9         TCP      214    50241→52356 [PSH, ACK] Seq=1037 Ack=1 Win=8192 Len=148 TSval=5720 TSecr=1837165

Frame 21: 214 bytes on wire (1712 bits), 214 bytes captured (1712 bits) on interface 0
Ethernet II, Src: Ricoh_e5:a9:f8 (00:00:74:e5:a9:f8), Dst: 00:9a:9e:9d:93:47 (00:9a:9e:9d:93:47)
Internet Protocol Version 4, Src: 192.168.255.10 (192.168.255.10), Dst: 192.168.255.9 (192.168.255.9)
Transmission Control Protocol, Src Port: 50241 (50241), Dst Port: 52356 (52356), Seq: 1037, Ack: 1, Len: 148
Data (148 bytes)

0000  90 00 00 00 0f 00 00 00 01 00 00 00 00 00 00 00   ................
0010  00 00 00 00 06 00 00 00 00 00 00 00 86 56 4d be   .............VM.
0020  a5 73 5d 3f 69 aa c7 3d cb 1d b6 be 0b e6 80 be   .s]?i..=........
0030  c9 95 e5 bd e6 65 98 be 00 00 00 00 00 00 00 00   .....e..........
0040  00 00 00 00 00 00 00 00 00 00 00 00 00 00 00 00   ................
0050  00 00 00 00 00 00 00 00 00 00 00 00 00 00 00 00   ................
0060  00 00 00 00 00 00 00 00 00 00 00 00 00 00 00 00   ................
0070  00 00 00 00 00 00 00 00 00 00 00 00 00 00 00 00   ................
0080  00 00 00 00 00 00 00 00 00 00 00 00 00 00 00 00   ................
0090  00 00 00 00                                       ....

No.     Time           Source                Destination           Protocol Length Info
     22 4.640828000    192.168.255.9         192.168.255.10        TCP      66     52356→50241 [ACK] Seq=1 Ack=1185 Win=34688 Len=0 TSval=1837171 TSecr=5720

Frame 22: 66 bytes on wire (528 bits), 66 bytes captured (528 bits) on interface 0
Ethernet II, Src: 00:9a:9e:9d:93:47 (00:9a:9e:9d:93:47), Dst: Ricoh_e5:a9:f8 (00:00:74:e5:a9:f8)
Internet Protocol Version 4, Src: 192.168.255.9 (192.168.255.9), Dst: 192.168.255.10 (192.168.255.10)
Transmission Control Protocol, Src Port: 52356 (52356), Dst Port: 50241 (50241), Seq: 1, Ack: 1185, Len: 0

No.     Time           Source                Destination           Protocol Length Info
     23 4.640793000    192.168.255.10        192.168.255.9         TCP      214    50241→52356 [PSH, ACK] Seq=1185 Ack=1 Win=8192 Len=148 TSval=5720 TSecr=1837165

Frame 23: 214 bytes on wire (1712 bits), 214 bytes captured (1712 bits) on interface 0
Ethernet II, Src: Ricoh_e5:a9:f8 (00:00:74:e5:a9:f8), Dst: 00:9a:9e:9d:93:47 (00:9a:9e:9d:93:47)
Internet Protocol Version 4, Src: 192.168.255.10 (192.168.255.10), Dst: 192.168.255.9 (192.168.255.9)
Transmission Control Protocol, Src Port: 50241 (50241), Dst Port: 52356 (52356), Seq: 1185, Ack: 1, Len: 148
Data (148 bytes)

0000  90 00 00 00 0f 00 00 00 01 00 00 00 00 00 00 00   ................
0010  01 00 00 00 06 00 00 00 00 00 00 00 a0 92 92 be   ................
0020  27 50 bb 3f 73 1d 0c bd 07 17 62 bf 79 25 a9 bf   'P.?s.....b.y%..
0030  a8 63 da bf 49 e7 1b 40 00 00 00 00 00 00 00 00   .c..I..@........
0040  00 00 00 00 00 00 00 00 00 00 00 00 00 00 00 00   ................
0050  00 00 00 00 00 00 00 00 00 00 00 00 00 00 00 00   ................
0060  00 00 00 00 00 00 00 00 00 00 00 00 00 00 00 00   ................
0070  00 00 00 00 00 00 00 00 00 00 00 00 00 00 00 00   ................
0080  00 00 00 00 00 00 00 00 00 00 00 00 00 00 00 00   ................
0090  00 00 00 00                                       ....

No.     Time           Source                Destination           Protocol Length Info
     24 4.640846000    192.168.255.9         192.168.255.10        TCP      66     52356→50241 [ACK] Seq=1 Ack=1333 Win=35712 Len=0 TSval=1837171 TSecr=5720

Frame 24: 66 bytes on wire (528 bits), 66 bytes captured (528 bits) on interface 0
Ethernet II, Src: 00:9a:9e:9d:93:47 (00:9a:9e:9d:93:47), Dst: Ricoh_e5:a9:f8 (00:00:74:e5:a9:f8)
Internet Protocol Version 4, Src: 192.168.255.9 (192.168.255.9), Dst: 192.168.255.10 (192.168.255.10)
Transmission Control Protocol, Src Port: 52356 (52356), Dst Port: 50241 (50241), Seq: 1, Ack: 1333, Len: 0

No.     Time           Source                Destination           Protocol Length Info
     25 4.640794000    192.168.255.10        192.168.255.9         TCP      214    50241→52356 [PSH, ACK] Seq=1333 Ack=1 Win=8192 Len=148 TSval=5720 TSecr=1837165

Frame 25: 214 bytes on wire (1712 bits), 214 bytes captured (1712 bits) on interface 0
Ethernet II, Src: Ricoh_e5:a9:f8 (00:00:74:e5:a9:f8), Dst: 00:9a:9e:9d:93:47 (00:9a:9e:9d:93:47)
Internet Protocol Version 4, Src: 192.168.255.10 (192.168.255.10), Dst: 192.168.255.9 (192.168.255.9)
Transmission Control Protocol, Src Port: 50241 (50241), Dst Port: 52356 (52356), Seq: 1333, Ack: 1, Len: 148
Data (148 bytes)

0000  90 00 00 00 0f 00 00 00 01 00 00 00 00 00 00 00   ................
0010  02 00 00 00 06 00 00 00 00 00 00 00 72 39 7c bd   ............r9|.
0020  00 00 00 00 00 00 00 00 00 00 00 00 00 00 00 00   ................
0030  00 00 00 00 00 00 00 00 00 00 00 00 00 00 00 00   ................
0040  00 00 00 00 00 00 00 00 00 00 00 00 00 00 00 00   ................
0050  00 00 00 00 fe c3 a3 4b a0 ab ba 48 10 47 c3 4b   .......K...H.G.K
0060  45 2a ca 4b 00 00 00 00 00 00 00 00 00 00 00 00   E*.K............
0070  00 00 00 00 00 00 00 00 00 00 00 00 00 00 00 00   ................
0080  00 00 00 00 00 00 00 00 00 00 00 00 00 00 00 00   ................
0090  00 00 00 00                                       ....

No.     Time           Source                Destination           Protocol Length Info
     26 4.640852000    192.168.255.9         192.168.255.10        TCP      66     52356→50241 [ACK] Seq=1 Ack=1481 Win=36864 Len=0 TSval=1837171 TSecr=5720

Frame 26: 66 bytes on wire (528 bits), 66 bytes captured (528 bits) on interface 0
Ethernet II, Src: 00:9a:9e:9d:93:47 (00:9a:9e:9d:93:47), Dst: Ricoh_e5:a9:f8 (00:00:74:e5:a9:f8)
Internet Protocol Version 4, Src: 192.168.255.9 (192.168.255.9), Dst: 192.168.255.10 (192.168.255.10)
Transmission Control Protocol, Src Port: 52356 (52356), Dst Port: 50241 (50241), Seq: 1, Ack: 1481, Len: 0

No.     Time           Source                Destination           Protocol Length Info
     27 4.641032000    192.168.255.10        192.168.255.9         TCP      614    50241→52356 [PSH, ACK] Seq=1481 Ack=1 Win=8192 Len=548 TSval=5720 TSecr=1837165

Frame 27: 614 bytes on wire (4912 bits), 614 bytes captured (4912 bits) on interface 0
Ethernet II, Src: Ricoh_e5:a9:f8 (00:00:74:e5:a9:f8), Dst: 00:9a:9e:9d:93:47 (00:9a:9e:9d:93:47)
Internet Protocol Version 4, Src: 192.168.255.10 (192.168.255.10), Dst: 192.168.255.9 (192.168.255.9)
Transmission Control Protocol, Src Port: 50241 (50241), Dst Port: 52356 (52356), Seq: 1481, Ack: 1, Len: 548
Data (548 bytes)

0000  20 02 00 00 e1 07 00 00 01 00 00 00 00 00 00 00    ...............
0010  03 00 00 00 00 00 00 00 06 00 00 00 00 00 00 00   ................
0020  86 56 4d be a5 73 5d 3f 69 aa c7 3d cb 1d b6 be   .VM..s]?i..=....
0030  0b e6 80 be c9 95 e5 bd e6 65 98 be 00 00 00 00   .........e......
0040  00 00 00 00 00 00 00 00 00 00 00 00 00 00 00 00   ................
0050  00 00 00 00 00 00 00 00 00 00 00 00 00 00 00 00   ................
0060  00 00 00 00 00 00 00 00 00 00 00 00 00 00 00 00   ................
0070  00 00 00 00 00 00 00 00 00 00 00 00 00 00 00 00   ................
0080  00 00 00 00 00 00 00 00 00 00 00 00 00 00 00 00   ................
0090  00 00 00 00 00 00 00 00 01 00 00 00 06 00 00 00   ................
00a0  00 00 00 00 a0 92 92 be 27 50 bb 3f 73 1d 0c bd   ........'P.?s...
00b0  07 17 62 bf 79 25 a9 bf a8 63 da bf 49 e7 1b 40   ..b.y%...c..I..@
00c0  00 00 00 00 00 00 00 00 00 00 00 00 00 00 00 00   ................
00d0  00 00 00 00 00 00 00 00 00 00 00 00 00 00 00 00   ................
00e0  00 00 00 00 00 00 00 00 00 00 00 00 00 00 00 00   ................
00f0  00 00 00 00 00 00 00 00 00 00 00 00 00 00 00 00   ................
0100  00 00 00 00 00 00 00 00 00 00 00 00 00 00 00 00   ................
0110  00 00 00 00 00 00 00 00 00 00 00 00 02 00 00 00   ................
0120  06 00 00 00 00 00 00 00 72 39 7c bd 00 00 00 00   ........r9|.....
0130  00 00 00 00 00 00 00 00 00 00 00 00 00 00 00 00   ................
0140  00 00 00 00 00 00 00 00 00 00 00 00 00 00 00 00   ................
0150  00 00 00 00 00 00 00 00 00 00 00 00 00 00 00 00   ................
0160  fe c3 a3 4b a0 ab ba 48 10 47 c3 4b 45 2a ca 4b   ...K...H.G.KE*.K
0170  00 00 00 00 00 00 00 00 00 00 00 00 00 00 00 00   ................
0180  00 00 00 00 00 00 00 00 00 00 00 00 00 00 00 00   ................
0190  00 00 00 00 00 00 00 00 00 00 00 00 00 00 00 00   ................
01a0  00 00 00 00 00 00 00 00 00 00 00 00 00 00 00 00   ................
01b0  00 00 00 00 00 00 00 00 00 00 00 00 00 00 00 00   ................
01c0  00 00 00 00 00 00 00 00 00 00 00 00 00 00 00 00   ................
01d0  00 00 00 00 00 00 00 00 00 00 00 00 00 00 00 00   ................
01e0  00 00 00 00 00 00 00 00 00 00 00 00 00 00 00 00   ................
01f0  00 00 00 00 00 00 00 00 00 00 00 00 00 00 00 00   ................
0200  00 00 00 00 00 00 00 00 00 00 00 00 00 00 00 00   ................
0210  00 00 00 00 00 00 00 00 00 00 00 00 00 00 00 00   ................
0220  00 00 00 00                                       ....

No.     Time           Source                Destination           Protocol Length Info
     28 4.641050000    192.168.255.9         192.168.255.10        TCP      66     52356→50241 [ACK] Seq=1 Ack=2029 Win=38016 Len=0 TSval=1837171 TSecr=5720

Frame 28: 66 bytes on wire (528 bits), 66 bytes captured (528 bits) on interface 0
Ethernet II, Src: 00:9a:9e:9d:93:47 (00:9a:9e:9d:93:47), Dst: Ricoh_e5:a9:f8 (00:00:74:e5:a9:f8)
Internet Protocol Version 4, Src: 192.168.255.9 (192.168.255.9), Dst: 192.168.255.10 (192.168.255.10)
Transmission Control Protocol, Src Port: 52356 (52356), Dst Port: 50241 (50241), Seq: 1, Ack: 2029, Len: 0

No.     Time           Source                Destination           Protocol Length Info
     29 4.641033000    192.168.255.10        192.168.255.9         TCP      110    50241→52356 [PSH, ACK] Seq=2029 Ack=1 Win=8192 Len=44 TSval=5720 TSecr=1837165

Frame 29: 110 bytes on wire (880 bits), 110 bytes captured (880 bits) on interface 0
Ethernet II, Src: Ricoh_e5:a9:f8 (00:00:74:e5:a9:f8), Dst: 00:9a:9e:9d:93:47 (00:9a:9e:9d:93:47)
Internet Protocol Version 4, Src: 192.168.255.10 (192.168.255.10), Dst: 192.168.255.9 (192.168.255.9)
Transmission Control Protocol, Src Port: 50241 (50241), Dst Port: 52356 (52356), Seq: 2029, Ack: 1, Len: 44
Data (44 bytes)

0000  28 00 00 00 0d 00 00 00 01 00 00 00 00 00 00 00   (...............
0010  00 00 00 00 00 00 00 00 00 00 00 00 00 00 00 00   ................
0020  00 00 00 00 02 00 00 00 00 00 00 00               ............

No.     Time           Source                Destination           Protocol Length Info
     30 4.641062000    192.168.255.9         192.168.255.10        TCP      66     52356→50241 [ACK] Seq=1 Ack=2073 Win=38016 Len=0 TSval=1837171 TSecr=5720

Frame 30: 66 bytes on wire (528 bits), 66 bytes captured (528 bits) on interface 0
Ethernet II, Src: 00:9a:9e:9d:93:47 (00:9a:9e:9d:93:47), Dst: Ricoh_e5:a9:f8 (00:00:74:e5:a9:f8)
Internet Protocol Version 4, Src: 192.168.255.9 (192.168.255.9), Dst: 192.168.255.10 (192.168.255.10)
Transmission Control Protocol, Src Port: 52356 (52356), Dst Port: 50241 (50241), Seq: 1, Ack: 2073, Len: 0

No.     Time           Source                Destination           Protocol Length Info
     31 4.666019000    192.168.255.10        192.168.255.9         TCP      214    50241→52356 [PSH, ACK] Seq=2073 Ack=1 Win=8192 Len=148 TSval=5720 TSecr=1837171

Frame 31: 214 bytes on wire (1712 bits), 214 bytes captured (1712 bits) on interface 0
Ethernet II, Src: Ricoh_e5:a9:f8 (00:00:74:e5:a9:f8), Dst: 00:9a:9e:9d:93:47 (00:9a:9e:9d:93:47)
Internet Protocol Version 4, Src: 192.168.255.10 (192.168.255.10), Dst: 192.168.255.9 (192.168.255.9)
Transmission Control Protocol, Src Port: 50241 (50241), Dst Port: 52356 (52356), Seq: 2073, Ack: 1, Len: 148
Data (148 bytes)

0000  90 00 00 00 0f 00 00 00 01 00 00 00 00 00 00 00   ................
0010  00 00 00 00 06 00 00 00 00 00 00 00 86 56 4d be   .............VM.
0020  a5 73 5d 3f 69 aa c7 3d cb 1d b6 be 0b e6 80 be   .s]?i..=........
0030  c9 95 e5 bd e6 65 98 be 00 00 00 00 00 00 00 00   .....e..........
0040  00 00 00 00 00 00 00 00 00 00 00 00 00 00 00 00   ................
0050  00 00 00 00 00 00 00 00 00 00 00 00 00 00 00 00   ................
0060  00 00 00 00 00 00 00 00 00 00 00 00 00 00 00 00   ................
0070  00 00 00 00 00 00 00 00 00 00 00 00 00 00 00 00   ................
0080  00 00 00 00 00 00 00 00 00 00 00 00 00 00 00 00   ................
0090  00 00 00 00                                       ....

No.     Time           Source                Destination           Protocol Length Info
     32 4.666047000    192.168.255.9         192.168.255.10        TCP      66     52356→50241 [ACK] Seq=1 Ack=2221 Win=39040 Len=0 TSval=1837177 TSecr=5720

Frame 32: 66 bytes on wire (528 bits), 66 bytes captured (528 bits) on interface 0
Ethernet II, Src: 00:9a:9e:9d:93:47 (00:9a:9e:9d:93:47), Dst: Ricoh_e5:a9:f8 (00:00:74:e5:a9:f8)
Internet Protocol Version 4, Src: 192.168.255.9 (192.168.255.9), Dst: 192.168.255.10 (192.168.255.10)
Transmission Control Protocol, Src Port: 52356 (52356), Dst Port: 50241 (50241), Seq: 1, Ack: 2221, Len: 0

No.     Time           Source                Destination           Protocol Length Info
     33 4.666020000    192.168.255.10        192.168.255.9         TCP      214    50241→52356 [PSH, ACK] Seq=2221 Ack=1 Win=8192 Len=148 TSval=5720 TSecr=1837171

Frame 33: 214 bytes on wire (1712 bits), 214 bytes captured (1712 bits) on interface 0
Ethernet II, Src: Ricoh_e5:a9:f8 (00:00:74:e5:a9:f8), Dst: 00:9a:9e:9d:93:47 (00:9a:9e:9d:93:47)
Internet Protocol Version 4, Src: 192.168.255.10 (192.168.255.10), Dst: 192.168.255.9 (192.168.255.9)
Transmission Control Protocol, Src Port: 50241 (50241), Dst Port: 52356 (52356), Seq: 2221, Ack: 1, Len: 148
Data (148 bytes)

0000  90 00 00 00 0f 00 00 00 01 00 00 00 00 00 00 00   ................
0010  01 00 00 00 06 00 00 00 00 00 00 00 a0 92 92 be   ................
0020  27 50 bb 3f 73 1d 0c bd 07 17 62 bf 79 25 a9 bf   'P.?s.....b.y%..
0030  a8 63 da bf 49 e7 1b 40 00 00 00 00 00 00 00 00   .c..I..@........
0040  00 00 00 00 00 00 00 00 00 00 00 00 00 00 00 00   ................
0050  00 00 00 00 00 00 00 00 00 00 00 00 00 00 00 00   ................
0060  00 00 00 00 00 00 00 00 00 00 00 00 00 00 00 00   ................
0070  00 00 00 00 00 00 00 00 00 00 00 00 00 00 00 00   ................
0080  00 00 00 00 00 00 00 00 00 00 00 00 00 00 00 00   ................
0090  00 00 00 00                                       ....

No.     Time           Source                Destination           Protocol Length Info
     34 4.666058000    192.168.255.9         192.168.255.10        TCP      66     52356→50241 [ACK] Seq=1 Ack=2369 Win=40192 Len=0 TSval=1837177 TSecr=5720

Frame 34: 66 bytes on wire (528 bits), 66 bytes captured (528 bits) on interface 0
Ethernet II, Src: 00:9a:9e:9d:93:47 (00:9a:9e:9d:93:47), Dst: Ricoh_e5:a9:f8 (00:00:74:e5:a9:f8)
Internet Protocol Version 4, Src: 192.168.255.9 (192.168.255.9), Dst: 192.168.255.10 (192.168.255.10)
Transmission Control Protocol, Src Port: 52356 (52356), Dst Port: 50241 (50241), Seq: 1, Ack: 2369, Len: 0

No.     Time           Source                Destination           Protocol Length Info
     35 4.666020000    192.168.255.10        192.168.255.9         TCP      214    50241→52356 [PSH, ACK] Seq=2369 Ack=1 Win=8192 Len=148 TSval=5720 TSecr=1837171

Frame 35: 214 bytes on wire (1712 bits), 214 bytes captured (1712 bits) on interface 0
Ethernet II, Src: Ricoh_e5:a9:f8 (00:00:74:e5:a9:f8), Dst: 00:9a:9e:9d:93:47 (00:9a:9e:9d:93:47)
Internet Protocol Version 4, Src: 192.168.255.10 (192.168.255.10), Dst: 192.168.255.9 (192.168.255.9)
Transmission Control Protocol, Src Port: 50241 (50241), Dst Port: 52356 (52356), Seq: 2369, Ack: 1, Len: 148
Data (148 bytes)

0000  90 00 00 00 0f 00 00 00 01 00 00 00 00 00 00 00   ................
0010  02 00 00 00 06 00 00 00 00 00 00 00 72 39 7c bd   ............r9|.
0020  00 00 00 00 00 00 00 00 00 00 00 00 00 00 00 00   ................
0030  00 00 00 00 00 00 00 00 00 00 00 00 00 00 00 00   ................
0040  00 00 00 00 00 00 00 00 00 00 00 00 00 00 00 00   ................
0050  00 00 00 00 fe c3 a3 4b a0 ab ba 48 10 47 c3 4b   .......K...H.G.K
0060  33 2a ca 4b 00 00 00 00 00 00 00 00 00 00 00 00   3*.K............
0070  00 00 00 00 00 00 00 00 00 00 00 00 00 00 00 00   ................
0080  00 00 00 00 00 00 00 00 00 00 00 00 00 00 00 00   ................
0090  00 00 00 00                                       ....

No.     Time           Source                Destination           Protocol Length Info
     36 4.666066000    192.168.255.9         192.168.255.10        TCP      66     52356→50241 [ACK] Seq=1 Ack=2517 Win=41216 Len=0 TSval=1837177 TSecr=5720

Frame 36: 66 bytes on wire (528 bits), 66 bytes captured (528 bits) on interface 0
Ethernet II, Src: 00:9a:9e:9d:93:47 (00:9a:9e:9d:93:47), Dst: Ricoh_e5:a9:f8 (00:00:74:e5:a9:f8)
Internet Protocol Version 4, Src: 192.168.255.9 (192.168.255.9), Dst: 192.168.255.10 (192.168.255.10)
Transmission Control Protocol, Src Port: 52356 (52356), Dst Port: 50241 (50241), Seq: 1, Ack: 2517, Len: 0

No.     Time           Source                Destination           Protocol Length Info
     37 4.666256000    192.168.255.10        192.168.255.9         TCP      614    50241→52356 [PSH, ACK] Seq=2517 Ack=1 Win=8192 Len=548 TSval=5720 TSecr=1837171

Frame 37: 614 bytes on wire (4912 bits), 614 bytes captured (4912 bits) on interface 0
Ethernet II, Src: Ricoh_e5:a9:f8 (00:00:74:e5:a9:f8), Dst: 00:9a:9e:9d:93:47 (00:9a:9e:9d:93:47)
Internet Protocol Version 4, Src: 192.168.255.10 (192.168.255.10), Dst: 192.168.255.9 (192.168.255.9)
Transmission Control Protocol, Src Port: 50241 (50241), Dst Port: 52356 (52356), Seq: 2517, Ack: 1, Len: 548
Data (548 bytes)

0000  20 02 00 00 e1 07 00 00 01 00 00 00 00 00 00 00    ...............
0010  03 00 00 00 00 00 00 00 06 00 00 00 00 00 00 00   ................
0020  86 56 4d be a5 73 5d 3f 69 aa c7 3d cb 1d b6 be   .VM..s]?i..=....
0030  0b e6 80 be c9 95 e5 bd e6 65 98 be 00 00 00 00   .........e......
0040  00 00 00 00 00 00 00 00 00 00 00 00 00 00 00 00   ................
0050  00 00 00 00 00 00 00 00 00 00 00 00 00 00 00 00   ................
0060  00 00 00 00 00 00 00 00 00 00 00 00 00 00 00 00   ................
0070  00 00 00 00 00 00 00 00 00 00 00 00 00 00 00 00   ................
0080  00 00 00 00 00 00 00 00 00 00 00 00 00 00 00 00   ................
0090  00 00 00 00 00 00 00 00 01 00 00 00 06 00 00 00   ................
00a0  00 00 00 00 a0 92 92 be 27 50 bb 3f 73 1d 0c bd   ........'P.?s...
00b0  07 17 62 bf 79 25 a9 bf a8 63 da bf 49 e7 1b 40   ..b.y%...c..I..@
00c0  00 00 00 00 00 00 00 00 00 00 00 00 00 00 00 00   ................
00d0  00 00 00 00 00 00 00 00 00 00 00 00 00 00 00 00   ................
00e0  00 00 00 00 00 00 00 00 00 00 00 00 00 00 00 00   ................
00f0  00 00 00 00 00 00 00 00 00 00 00 00 00 00 00 00   ................
0100  00 00 00 00 00 00 00 00 00 00 00 00 00 00 00 00   ................
0110  00 00 00 00 00 00 00 00 00 00 00 00 02 00 00 00   ................
0120  06 00 00 00 00 00 00 00 72 39 7c bd 00 00 00 00   ........r9|.....
0130  00 00 00 00 00 00 00 00 00 00 00 00 00 00 00 00   ................
0140  00 00 00 00 00 00 00 00 00 00 00 00 00 00 00 00   ................
0150  00 00 00 00 00 00 00 00 00 00 00 00 00 00 00 00   ................
0160  fe c3 a3 4b a0 ab ba 48 10 47 c3 4b 33 2a ca 4b   ...K...H.G.K3*.K
0170  00 00 00 00 00 00 00 00 00 00 00 00 00 00 00 00   ................
0180  00 00 00 00 00 00 00 00 00 00 00 00 00 00 00 00   ................
0190  00 00 00 00 00 00 00 00 00 00 00 00 00 00 00 00   ................
01a0  00 00 00 00 00 00 00 00 00 00 00 00 00 00 00 00   ................
01b0  00 00 00 00 00 00 00 00 00 00 00 00 00 00 00 00   ................
01c0  00 00 00 00 00 00 00 00 00 00 00 00 00 00 00 00   ................
01d0  00 00 00 00 00 00 00 00 00 00 00 00 00 00 00 00   ................
01e0  00 00 00 00 00 00 00 00 00 00 00 00 00 00 00 00   ................
01f0  00 00 00 00 00 00 00 00 00 00 00 00 00 00 00 00   ................
0200  00 00 00 00 00 00 00 00 00 00 00 00 00 00 00 00   ................
0210  00 00 00 00 00 00 00 00 00 00 00 00 00 00 00 00   ................
0220  00 00 00 00                                       ....

No.     Time           Source                Destination           Protocol Length Info
     38 4.666264000    192.168.255.9         192.168.255.10        TCP      66     52356→50241 [ACK] Seq=1 Ack=3065 Win=42368 Len=0 TSval=1837177 TSecr=5720

Frame 38: 66 bytes on wire (528 bits), 66 bytes captured (528 bits) on interface 0
Ethernet II, Src: 00:9a:9e:9d:93:47 (00:9a:9e:9d:93:47), Dst: Ricoh_e5:a9:f8 (00:00:74:e5:a9:f8)
Internet Protocol Version 4, Src: 192.168.255.9 (192.168.255.9), Dst: 192.168.255.10 (192.168.255.10)
Transmission Control Protocol, Src Port: 52356 (52356), Dst Port: 50241 (50241), Seq: 1, Ack: 3065, Len: 0

No.     Time           Source                Destination           Protocol Length Info
     39 4.666256000    192.168.255.10        192.168.255.9         TCP      110    50241→52356 [PSH, ACK] Seq=3065 Ack=1 Win=8192 Len=44 TSval=5720 TSecr=1837171

Frame 39: 110 bytes on wire (880 bits), 110 bytes captured (880 bits) on interface 0
Ethernet II, Src: Ricoh_e5:a9:f8 (00:00:74:e5:a9:f8), Dst: 00:9a:9e:9d:93:47 (00:9a:9e:9d:93:47)
Internet Protocol Version 4, Src: 192.168.255.10 (192.168.255.10), Dst: 192.168.255.9 (192.168.255.9)
Transmission Control Protocol, Src Port: 50241 (50241), Dst Port: 52356 (52356), Seq: 3065, Ack: 1, Len: 44
Data (44 bytes)

0000  28 00 00 00 0d 00 00 00 01 00 00 00 00 00 00 00   (...............
0010  00 00 00 00 00 00 00 00 00 00 00 00 00 00 00 00   ................
0020  00 00 00 00 02 00 00 00 00 00 00 00               ............

No.     Time           Source                Destination           Protocol Length Info
     40 4.666270000    192.168.255.9         192.168.255.10        TCP      66     52356→50241 [ACK] Seq=1 Ack=3109 Win=42368 Len=0 TSval=1837177 TSecr=5720

Frame 40: 66 bytes on wire (528 bits), 66 bytes captured (528 bits) on interface 0
